No.,Time,Source,Destination,Protocol,Length,Info,,,,,,,time 2,time 1,delay 1,delay 2,jitter
1,0,192.168.43.119,192.168.43.255,NBNS,92,Name query NB WPAD<00>,,,,,,,0.000674,0,0.000674,0.00028,0.000394
2,0.000674,fe80::9c9f:8930:3bd4:496e,ff02::1:3,LLMNR,84,Standard query 0xd719 A wpad,,,,,,,0.000954,0.000674,0.00028,0.12414,0.12386
3,0.000954,192.168.43.119,224.0.0.252,LLMNR,64,Standard query 0xd719 A wpad,,,,,,,0.125094,0.000954,0.12414,0.000331,0.123809
4,0.125094,192.168.43.119,192.168.43.255,NBNS,92,Name query NB WPAD<00>,,,,,,,0.125425,0.125094,0.000331,0.00054,0.000209
5,0.125425,192.168.43.119,192.168.43.255,NBNS,92,Name query NB WPAD<00>,,,,,,,0.125965,0.125425,0.00054,4.4E-05,0.000496
6,0.125965,fe80::9c9f:8930:3bd4:496e,ff02::1:3,LLMNR,84,Standard query 0xf8e5 A wpad,,,,,,,0.126009,0.125965,4.4E-05,0.000208,0.000164
7,0.126009,fe80::9c9f:8930:3bd4:496e,ff02::1:3,LLMNR,84,Standard query 0x480c A wpad,,,,,,,0.126217,0.126009,0.000208,6.1E-05,0.000147
8,0.126217,192.168.43.119,224.0.0.252,LLMNR,64,Standard query 0x480c A wpad,,,,,,,0.126278,0.126217,6.1E-05,0.000728,0.000667
9,0.126278,192.168.43.119,224.0.0.252,LLMNR,64,Standard query 0xf8e5 A wpad,,,,,,,0.127006,0.126278,0.000728,0.000547,0.000181
10,0.127006,192.168.43.119,192.168.43.255,NBNS,92,Name query NB WPAD<00>,,,,,,,0.127553,0.127006,0.000547,0.000262,0.000285
11,0.127553,fe80::9c9f:8930:3bd4:496e,ff02::1:3,LLMNR,84,Standard query 0x415d A wpad,,,,,,,0.127815,0.127553,0.000262,0.289383,0.289121
12,0.127815,192.168.43.119,224.0.0.252,LLMNR,64,Standard query 0x415d A wpad,,,,,,,0.417198,0.127815,0.289383,0.000224,0.289159
13,0.417198,fe80::9c9f:8930:3bd4:496e,ff02::1:3,LLMNR,84,Standard query 0xd719 A wpad,,,,,,,0.417422,0.417198,0.000224,0.124733,0.124509
14,0.417422,192.168.43.119,224.0.0.252,LLMNR,64,Standard query 0xd719 A wpad,,,,,,,0.542155,0.417422,0.124733,2.8E-05,0.124705
15,0.542155,fe80::9c9f:8930:3bd4:496e,ff02::1:3,LLMNR,84,Standard query 0xf8e5 A wpad,,,,,,,0.542183,0.542155,2.8E-05,0.000149,0.000121
16,0.542183,fe80::9c9f:8930:3bd4:496e,ff02::1:3,LLMNR,84,Standard query 0x415d A wpad,,,,,,,0.542332,0.542183,0.000149,8.9E-05,6E-05
17,0.542332,192.168.43.119,224.0.0.252,LLMNR,64,Standard query 0x415d A wpad,,,,,,,0.542421,0.542332,8.9E-05,0.000118,2.9E-05
18,0.542421,192.168.43.119,224.0.0.252,LLMNR,64,Standard query 0xf8e5 A wpad,,,,,,,0.542539,0.542421,0.000118,,
19,0.542539,fe80::9c9f:8930:3bd4:496e,ff02::1:3,LLMNR,84,Standard query 0x480c A wpad,,,,,,,,tot delay,0.542539,tot jitter,1.077916
20,0.542722,192.168.43.119,224.0.0.252,LLMNR,64,Standard query 0x480c A wpad,,,,,,,,rat delay,2.24542E-05,rat jitter,4.4612E-05
21,0.745224,192.168.43.119,192.168.43.255,NBNS,92,Name query NB WPAD<00>,,,,,,,,,,,
22,0.870311,192.168.43.119,192.168.43.255,NBNS,92,Name query NB WPAD<00>,,,,,,,,,,,
23,0.870505,192.168.43.119,192.168.43.255,NBNS,92,Name query NB WPAD<00>,,,,,,,,,,,
24,0.870614,192.168.43.119,192.168.43.255,NBNS,92,Name query NB WPAD<00>,,,,,,,,,,,
25,1.221174,fe80::9c9f:8930:3bd4:496e,ff02::1:2,DHCPv6,157,Solicit XID: 0x7de883 CID: 00010001219c10b0a81e84a01b87 ,,,,,,,,,,,
26,1.228471,fe80::2072:dff:fe39:154b,fe80::9c9f:8930:3bd4:496e,DHCPv6,144,Advertise XID: 0x7de883 CID: 00010001219c10b0a81e84a01b87 ,,,,,,,,,,,
27,1.502429,192.168.43.119,192.168.43.255,NBNS,92,Name query NB WPAD<00>,,,,,,,,,,,
28,1.62741,192.168.43.119,192.168.43.255,NBNS,92,Name query NB WPAD<00>,,,,,,,,,,,
29,1.627611,192.168.43.119,192.168.43.255,NBNS,92,Name query NB WPAD<00>,,,,,,,,,,,
30,1.627718,192.168.43.119,192.168.43.255,NBNS,92,Name query NB WPAD<00>,,,,,,,,,,,
31,2.25348,192.168.43.119,104.118.106.95,HTTP,372,GET /pr/64256afe-f5d9-4f86-8936-8840a6a4f5be/Office/Data/16.0.12527.21104/stream.x64.en-us.dat HTTP/1.1 ,,,,,,,,,,,
32,2.601024,104.118.106.95,192.168.43.119,HTTP,345,HTTP/1.1 301 Moved Permanently ,,,,,,,,,,,
33,2.601596,192.168.43.119,23.219.184.122,HTTP,386,GET /pr/64256afe-f5d9-4f86-8936-8840a6a4f5be/Office/Data/16.0.12527.21104/stream.x64.en-us.dat HTTP/1.1 ,,,,,,,,,,,
34,2.658648,192.168.43.119,104.118.106.95,TCP,54,50440  >  80 [ACK] Seq=319 Ack=292 Win=62 Len=0,,,,,,,,,,,
35,2.955221,23.219.184.122,192.168.43.119,TCP,1434,80  >  50442 [ACK] Seq=1 Ack=333 Win=245 Len=1380 [TCP segment of a reassembled PDU],,,,,,,,,,,
36,2.961384,23.219.184.122,192.168.43.119,TCP,1434,80  >  50442 [ACK] Seq=1381 Ack=333 Win=245 Len=1380 [TCP segment of a reassembled PDU],,,,,,,,,,,
37,2.961511,192.168.43.119,23.219.184.122,TCP,54,50442  >  80 [ACK] Seq=333 Ack=2761 Win=64 Len=0,,,,,,,,,,,
38,2.961686,23.219.184.122,192.168.43.119,TCP,1434,80  >  50442 [ACK] Seq=2761 Ack=333 Win=245 Len=1380 [TCP segment of a reassembled PDU],,,,,,,,,,,
39,2.964148,23.219.184.122,192.168.43.119,HTTP,532,HTTP/1.1 206 Partial Content ,,,,,,,,,,,
40,2.964267,192.168.43.119,23.219.184.122,TCP,54,50442  >  80 [ACK] Seq=333 Ack=4619 Win=64 Len=0,,,,,,,,,,,
41,3.347023,192.168.43.119,104.118.106.95,HTTP,372,GET /pr/64256afe-f5d9-4f86-8936-8840a6a4f5be/Office/Data/16.0.12527.21104/stream.x64.en-us.dat HTTP/1.1 ,,,,,,,,,,,
42,3.621044,104.118.106.95,192.168.43.119,HTTP,345,HTTP/1.1 301 Moved Permanently ,,,,,,,,,,,
43,3.621648,192.168.43.119,23.219.184.122,HTTP,386,GET /pr/64256afe-f5d9-4f86-8936-8840a6a4f5be/Office/Data/16.0.12527.21104/stream.x64.en-us.dat HTTP/1.1 ,,,,,,,,,,,
44,3.675212,192.168.43.119,104.118.106.95,TCP,54,50440  >  80 [ACK] Seq=637 Ack=583 Win=61 Len=0,,,,,,,,,,,
45,3.943862,23.219.184.122,192.168.43.119,TCP,1434,80  >  50442 [ACK] Seq=4619 Ack=665 Win=254 Len=1380 [TCP segment of a reassembled PDU],,,,,,,,,,,
46,3.950962,23.219.184.122,192.168.43.119,TCP,1434,80  >  50442 [ACK] Seq=5999 Ack=665 Win=254 Len=1380 [TCP segment of a reassembled PDU],,,,,,,,,,,
47,3.951067,192.168.43.119,23.219.184.122,TCP,54,50442  >  80 [ACK] Seq=665 Ack=7379 Win=64 Len=0,,,,,,,,,,,
48,3.954885,23.219.184.122,192.168.43.119,TCP,1434,80  >  50442 [ACK] Seq=7379 Ack=665 Win=254 Len=1380 [TCP segment of a reassembled PDU],,,,,,,,,,,
49,3.958797,23.219.184.122,192.168.43.119,TCP,1434,80  >  50442 [ACK] Seq=8759 Ack=665 Win=254 Len=1380 [TCP segment of a reassembled PDU],,,,,,,,,,,
50,3.958905,192.168.43.119,23.219.184.122,TCP,54,50442  >  80 [ACK] Seq=665 Ack=10139 Win=64 Len=0,,,,,,,,,,,
51,3.964558,23.219.184.122,192.168.43.119,TCP,1434,80  >  50442 [ACK] Seq=10139 Ack=665 Win=254 Len=1380 [TCP segment of a reassembled PDU],,,,,,,,,,,
52,3.964713,23.219.184.122,192.168.43.119,HTTP,375,HTTP/1.1 206 Partial Content ,,,,,,,,,,,
53,3.964771,192.168.43.119,23.219.184.122,TCP,54,50442  >  80 [ACK] Seq=665 Ack=11840 Win=64 Len=0,,,,,,,,,,,
54,6.894286,192.168.43.119,104.118.106.95,HTTP,372,GET /pr/64256afe-f5d9-4f86-8936-8840a6a4f5be/Office/Data/16.0.12527.21104/stream.x64.en-us.dat HTTP/1.1 ,,,,,,,,,,,
55,7.459145,104.118.106.95,192.168.43.119,HTTP,345,HTTP/1.1 301 Moved Permanently ,,,,,,,,,,,
56,7.460608,192.168.43.119,23.219.184.122,HTTP,386,GET /pr/64256afe-f5d9-4f86-8936-8840a6a4f5be/Office/Data/16.0.12527.21104/stream.x64.en-us.dat HTTP/1.1 ,,,,,,,,,,,
57,7.52096,192.168.43.119,104.118.106.95,TCP,54,50440  >  80 [ACK] Seq=955 Ack=874 Win=60 Len=0,,,,,,,,,,,
58,7.844279,23.219.184.122,192.168.43.119,TCP,1434,80  >  50442 [ACK] Seq=11840 Ack=997 Win=262 Len=1380 [TCP segment of a reassembled PDU],,,,,,,,,,,
59,7.846863,23.219.184.122,192.168.43.119,TCP,1434,80  >  50442 [ACK] Seq=13220 Ack=997 Win=262 Len=1380 [TCP segment of a reassembled PDU],,,,,,,,,,,
60,7.846998,192.168.43.119,23.219.184.122,TCP,54,50442  >  80 [ACK] Seq=997 Ack=14600 Win=64 Len=0,,,,,,,,,,,
61,7.850717,23.219.184.122,192.168.43.119,TCP,1434,80  >  50442 [ACK] Seq=14600 Ack=997 Win=262 Len=1380 [TCP segment of a reassembled PDU],,,,,,,,,,,
62,7.855415,23.219.184.122,192.168.43.119,TCP,1434,80  >  50442 [ACK] Seq=15980 Ack=997 Win=262 Len=1380 [TCP segment of a reassembled PDU],,,,,,,,,,,
63,7.855575,192.168.43.119,23.219.184.122,TCP,54,50442  >  80 [ACK] Seq=997 Ack=17360 Win=64 Len=0,,,,,,,,,,,
64,7.856359,23.219.184.122,192.168.43.119,TCP,1434,80  >  50442 [ACK] Seq=17360 Ack=997 Win=262 Len=1380 [TCP segment of a reassembled PDU],,,,,,,,,,,
65,7.880918,23.219.184.122,192.168.43.119,TCP,1434,80  >  50442 [ACK] Seq=18740 Ack=997 Win=262 Len=1380 [TCP segment of a reassembled PDU],,,,,,,,,,,
66,7.881078,192.168.43.119,23.219.184.122,TCP,54,50442  >  80 [ACK] Seq=997 Ack=20120 Win=64 Len=0,,,,,,,,,,,
67,7.897058,23.219.184.122,192.168.43.119,TCP,1434,80  >  50442 [ACK] Seq=20120 Ack=997 Win=262 Len=1380 [TCP segment of a reassembled PDU],,,,,,,,,,,
68,7.897443,23.219.184.122,192.168.43.119,TCP,1434,80  >  50442 [ACK] Seq=21500 Ack=997 Win=262 Len=1380 [TCP segment of a reassembled PDU],,,,,,,,,,,
69,7.897443,23.219.184.122,192.168.43.119,TCP,1434,80  >  50442 [ACK] Seq=22880 Ack=997 Win=262 Len=1380 [TCP segment of a reassembled PDU],,,,,,,,,,,
70,7.89764,192.168.43.119,23.219.184.122,TCP,54,50442  >  80 [ACK] Seq=997 Ack=24260 Win=64 Len=0,,,,,,,,,,,
71,7.914229,23.219.184.122,192.168.43.119,TCP,1434,80  >  50442 [ACK] Seq=24260 Ack=997 Win=262 Len=1380 [TCP segment of a reassembled PDU],,,,,,,,,,,
72,7.914409,192.168.43.119,23.219.184.122,TCP,54,50442  >  80 [ACK] Seq=997 Ack=25640 Win=64 Len=0,,,,,,,,,,,
73,7.914648,23.219.184.122,192.168.43.119,HTTP,421,HTTP/1.1 206 Partial Content ,,,,,,,,,,,
74,8.018589,192.168.43.119,23.219.184.122,TCP,54,50442  >  80 [ACK] Seq=997 Ack=26007 Win=63 Len=0,,,,,,,,,,,
75,10.09831,192.168.43.119,104.118.106.95,HTTP,372,GET /pr/64256afe-f5d9-4f86-8936-8840a6a4f5be/Office/Data/16.0.12527.21104/stream.x64.en-us.dat HTTP/1.1 ,,,,,,,,,,,
76,10.403166,104.118.106.95,192.168.43.119,HTTP,345,HTTP/1.1 301 Moved Permanently ,,,,,,,,,,,
77,10.40391,192.168.43.119,23.219.184.122,HTTP,386,GET /pr/64256afe-f5d9-4f86-8936-8840a6a4f5be/Office/Data/16.0.12527.21104/stream.x64.en-us.dat HTTP/1.1 ,,,,,,,,,,,
78,10.51885,192.168.43.119,104.118.106.95,TCP,54,50440  >  80 [ACK] Seq=1273 Ack=1165 Win=64 Len=0,,,,,,,,,,,
79,10.841175,23.219.184.122,192.168.43.119,TCP,1434,80  >  50442 [ACK] Seq=26007 Ack=1329 Win=270 Len=1380 [TCP segment of a reassembled PDU],,,,,,,,,,,
80,10.844908,23.219.184.122,192.168.43.119,TCP,1434,80  >  50442 [ACK] Seq=27387 Ack=1329 Win=270 Len=1380 [TCP segment of a reassembled PDU],,,,,,,,,,,
81,10.845064,192.168.43.119,23.219.184.122,TCP,54,50442  >  80 [ACK] Seq=1329 Ack=28767 Win=64 Len=0,,,,,,,,,,,
82,10.85097,23.219.184.122,192.168.43.119,TCP,1434,80  >  50442 [ACK] Seq=28767 Ack=1329 Win=270 Len=1380 [TCP segment of a reassembled PDU],,,,,,,,,,,
83,10.853666,23.219.184.122,192.168.43.119,TCP,1434,80  >  50442 [ACK] Seq=30147 Ack=1329 Win=270 Len=1380 [TCP segment of a reassembled PDU],,,,,,,,,,,
84,10.853853,192.168.43.119,23.219.184.122,TCP,54,50442  >  80 [ACK] Seq=1329 Ack=31527 Win=64 Len=0,,,,,,,,,,,
85,10.856965,23.219.184.122,192.168.43.119,TCP,1434,80  >  50442 [ACK] Seq=31527 Ack=1329 Win=270 Len=1380 [TCP segment of a reassembled PDU],,,,,,,,,,,
86,10.858432,23.219.184.122,192.168.43.119,TCP,1434,80  >  50442 [ACK] Seq=32907 Ack=1329 Win=270 Len=1380 [TCP segment of a reassembled PDU],,,,,,,,,,,
87,10.858614,192.168.43.119,23.219.184.122,TCP,54,50442  >  80 [ACK] Seq=1329 Ack=34287 Win=64 Len=0,,,,,,,,,,,
88,10.865275,23.219.184.122,192.168.43.119,TCP,1434,80  >  50442 [ACK] Seq=34287 Ack=1329 Win=270 Len=1380 [TCP segment of a reassembled PDU],,,,,,,,,,,
89,10.865556,23.219.184.122,192.168.43.119,TCP,1434,80  >  50442 [ACK] Seq=35667 Ack=1329 Win=270 Len=1380 [TCP segment of a reassembled PDU],,,,,,,,,,,
90,10.865737,192.168.43.119,23.219.184.122,TCP,54,50442  >  80 [ACK] Seq=1329 Ack=37047 Win=64 Len=0,,,,,,,,,,,
91,10.868954,23.219.184.122,192.168.43.119,TCP,1434,80  >  50442 [ACK] Seq=37047 Ack=1329 Win=270 Len=1380 [TCP segment of a reassembled PDU],,,,,,,,,,,
92,10.873567,23.219.184.122,192.168.43.119,TCP,1434,80  >  50442 [ACK] Seq=38427 Ack=1329 Win=270 Len=1380 [TCP segment of a reassembled PDU],,,,,,,,,,,
93,10.873746,192.168.43.119,23.219.184.122,TCP,54,50442  >  80 [ACK] Seq=1329 Ack=39807 Win=64 Len=0,,,,,,,,,,,
94,10.876888,23.219.184.122,192.168.43.119,TCP,1434,80  >  50442 [ACK] Seq=39807 Ack=1329 Win=270 Len=1380 [TCP segment of a reassembled PDU],,,,,,,,,,,
95,10.973718,23.219.184.122,192.168.43.119,TCP,1258,80  >  50442 [ACK] Seq=41187 Ack=1329 Win=228 Len=1204 [TCP segment of a reassembled PDU],,,,,,,,,,,
96,10.973828,192.168.43.119,23.219.184.122,TCP,54,50442  >  80 [ACK] Seq=1329 Ack=42391 Win=64 Len=0,,,,,,,,,,,
97,10.976861,23.219.184.122,192.168.43.119,TCP,1434,80  >  50442 [ACK] Seq=42391 Ack=1329 Win=228 Len=1380 [TCP segment of a reassembled PDU],,,,,,,,,,,
98,10.97709,23.219.184.122,192.168.43.119,TCP,230,"80  >  50442 [PSH, ACK] Seq=43771 Ack=1329 Win=228 Len=176 [TCP segment of a reassembled PDU]",,,,,,,,,,,
99,10.977227,192.168.43.119,23.219.184.122,TCP,54,50442  >  80 [ACK] Seq=1329 Ack=43947 Win=64 Len=0,,,,,,,,,,,
100,11.003537,23.219.184.122,192.168.43.119,TCP,1434,80  >  50442 [ACK] Seq=43947 Ack=1329 Win=228 Len=1380 [TCP segment of a reassembled PDU],,,,,,,,,,,
101,11.00883,23.219.184.122,192.168.43.119,TCP,1102,80  >  50442 [ACK] Seq=45327 Ack=1329 Win=228 Len=1048 [TCP segment of a reassembled PDU],,,,,,,,,,,
102,11.009018,192.168.43.119,23.219.184.122,TCP,54,50442  >  80 [ACK] Seq=1329 Ack=46375 Win=264 Len=0,,,,,,,,,,,
103,11.014094,23.219.184.122,192.168.43.119,TCP,1434,80  >  50442 [ACK] Seq=46375 Ack=1329 Win=228 Len=1380 [TCP segment of a reassembled PDU],,,,,,,,,,,
104,11.043599,23.219.184.122,192.168.43.119,TCP,1434,80  >  50442 [ACK] Seq=47755 Ack=1329 Win=228 Len=1380 [TCP segment of a reassembled PDU],,,,,,,,,,,
105,11.043774,192.168.43.119,23.219.184.122,TCP,54,50442  >  80 [ACK] Seq=1329 Ack=49135 Win=264 Len=0,,,,,,,,,,,
106,11.046864,23.219.184.122,192.168.43.119,TCP,1434,80  >  50442 [ACK] Seq=49135 Ack=1329 Win=228 Len=1380 [TCP segment of a reassembled PDU],,,,,,,,,,,
107,11.064154,23.219.184.122,192.168.43.119,TCP,386,80  >  50442 [ACK] Seq=50515 Ack=1329 Win=228 Len=332 [TCP segment of a reassembled PDU],,,,,,,,,,,
108,11.064294,192.168.43.119,23.219.184.122,TCP,54,50442  >  80 [ACK] Seq=1329 Ack=50847 Win=264 Len=0,,,,,,,,,,,
109,11.064718,23.219.184.122,192.168.43.119,TCP,1434,80  >  50442 [ACK] Seq=50847 Ack=1329 Win=228 Len=1380 [TCP segment of a reassembled PDU],,,,,,,,,,,
110,11.085012,23.219.184.122,192.168.43.119,TCP,1434,80  >  50442 [ACK] Seq=52227 Ack=1329 Win=228 Len=1380 [TCP segment of a reassembled PDU],,,,,,,,,,,
111,11.08519,192.168.43.119,23.219.184.122,TCP,54,50442  >  80 [ACK] Seq=1329 Ack=53607 Win=264 Len=0,,,,,,,,,,,
112,11.086343,23.219.184.122,192.168.43.119,TCP,1434,80  >  50442 [ACK] Seq=53607 Ack=1329 Win=228 Len=1380 [TCP segment of a reassembled PDU],,,,,,,,,,,
113,11.153933,23.219.184.122,192.168.43.119,TCP,1434,80  >  50442 [ACK] Seq=54987 Ack=1329 Win=228 Len=1380 [TCP segment of a reassembled PDU],,,,,,,,,,,
114,11.154064,192.168.43.119,23.219.184.122,TCP,54,50442  >  80 [ACK] Seq=1329 Ack=56367 Win=264 Len=0,,,,,,,,,,,
115,11.154254,23.219.184.122,192.168.43.119,HTTP,621,HTTP/1.1 206 Partial Content ,,,,,,,,,,,
116,11.222046,192.168.43.119,23.219.184.122,TCP,54,50442  >  80 [ACK] Seq=1329 Ack=56934 Win=261 Len=0,,,,,,,,,,,
117,13.504668,192.168.43.119,104.118.106.95,HTTP,372,GET /pr/64256afe-f5d9-4f86-8936-8840a6a4f5be/Office/Data/16.0.12527.21104/stream.x64.en-us.dat HTTP/1.1 ,,,,,,,,,,,
118,14.096973,104.118.106.95,192.168.43.119,HTTP,345,HTTP/1.1 301 Moved Permanently ,,,,,,,,,,,
119,14.098038,192.168.43.119,23.219.184.122,HTTP,386,GET /pr/64256afe-f5d9-4f86-8936-8840a6a4f5be/Office/Data/16.0.12527.21104/stream.x64.en-us.dat HTTP/1.1 ,,,,,,,,,,,
120,14.159884,192.168.43.119,104.118.106.95,TCP,54,50440  >  80 [ACK] Seq=1591 Ack=1456 Win=63 Len=0,,,,,,,,,,,
121,14.587153,23.219.184.122,192.168.43.119,TCP,1434,80  >  50442 [ACK] Seq=56934 Ack=1661 Win=279 Len=1380 [TCP segment of a reassembled PDU],,,,,,,,,,,
122,14.590791,23.219.184.122,192.168.43.119,TCP,1434,80  >  50442 [ACK] Seq=58314 Ack=1661 Win=279 Len=1380 [TCP segment of a reassembled PDU],,,,,,,,,,,
123,14.590949,192.168.43.119,23.219.184.122,TCP,54,50442  >  80 [ACK] Seq=1661 Ack=59694 Win=264 Len=0,,,,,,,,,,,
124,14.607306,23.219.184.122,192.168.43.119,TCP,1434,80  >  50442 [ACK] Seq=59694 Ack=1661 Win=279 Len=1380 [TCP segment of a reassembled PDU],,,,,,,,,,,
125,14.607565,23.219.184.122,192.168.43.119,TCP,1434,80  >  50442 [ACK] Seq=61074 Ack=1661 Win=279 Len=1380 [TCP segment of a reassembled PDU],,,,,,,,,,,
126,14.607747,192.168.43.119,23.219.184.122,TCP,54,50442  >  80 [ACK] Seq=1661 Ack=62454 Win=264 Len=0,,,,,,,,,,,
127,14.614409,23.219.184.122,192.168.43.119,TCP,1434,80  >  50442 [ACK] Seq=62454 Ack=1661 Win=279 Len=1380 [TCP segment of a reassembled PDU],,,,,,,,,,,
128,14.616984,23.219.184.122,192.168.43.119,TCP,1434,80  >  50442 [ACK] Seq=63834 Ack=1661 Win=279 Len=1380 [TCP segment of a reassembled PDU],,,,,,,,,,,
129,14.617234,192.168.43.119,23.219.184.122,TCP,54,50442  >  80 [ACK] Seq=1661 Ack=65214 Win=264 Len=0,,,,,,,,,,,
130,14.617447,23.219.184.122,192.168.43.119,TCP,1434,80  >  50442 [ACK] Seq=65214 Ack=1661 Win=279 Len=1380 [TCP segment of a reassembled PDU],,,,,,,,,,,
131,14.620792,23.219.184.122,192.168.43.119,TCP,1434,80  >  50442 [ACK] Seq=66594 Ack=1661 Win=279 Len=1380 [TCP segment of a reassembled PDU],,,,,,,,,,,
132,14.620971,192.168.43.119,23.219.184.122,TCP,54,50442  >  80 [ACK] Seq=1661 Ack=67974 Win=264 Len=0,,,,,,,,,,,
133,14.624794,23.219.184.122,192.168.43.119,TCP,1434,80  >  50442 [ACK] Seq=67974 Ack=1661 Win=279 Len=1380 [TCP segment of a reassembled PDU],,,,,,,,,,,
134,14.641804,23.219.184.122,192.168.43.119,TCP,1434,80  >  50442 [ACK] Seq=69354 Ack=1661 Win=279 Len=1380 [TCP segment of a reassembled PDU],,,,,,,,,,,
135,14.641981,192.168.43.119,23.219.184.122,TCP,54,50442  >  80 [ACK] Seq=1661 Ack=70734 Win=264 Len=0,,,,,,,,,,,
136,14.642234,23.219.184.122,192.168.43.119,TCP,1434,80  >  50442 [ACK] Seq=70734 Ack=1661 Win=279 Len=1380 [TCP segment of a reassembled PDU],,,,,,,,,,,
137,14.642234,23.219.184.122,192.168.43.119,TCP,1434,80  >  50442 [ACK] Seq=72114 Ack=1661 Win=279 Len=1380 [TCP segment of a reassembled PDU],,,,,,,,,,,
138,14.642491,192.168.43.119,23.219.184.122,TCP,54,50442  >  80 [ACK] Seq=1661 Ack=73494 Win=264 Len=0,,,,,,,,,,,
139,14.652602,23.219.184.122,192.168.43.119,TCP,1434,80  >  50442 [ACK] Seq=73494 Ack=1661 Win=279 Len=1380 [TCP segment of a reassembled PDU],,,,,,,,,,,
140,14.652981,23.219.184.122,192.168.43.119,TCP,1434,80  >  50442 [ACK] Seq=74874 Ack=1661 Win=279 Len=1380 [TCP segment of a reassembled PDU],,,,,,,,,,,
141,14.652981,23.219.184.122,192.168.43.119,TCP,1434,80  >  50442 [ACK] Seq=76254 Ack=1661 Win=279 Len=1380 [TCP segment of a reassembled PDU],,,,,,,,,,,
142,14.65306,192.168.43.119,23.219.184.122,TCP,54,50442  >  80 [ACK] Seq=1661 Ack=77634 Win=264 Len=0,,,,,,,,,,,
143,14.656847,23.219.184.122,192.168.43.119,TCP,1434,80  >  50442 [ACK] Seq=77634 Ack=1661 Win=279 Len=1380 [TCP segment of a reassembled PDU],,,,,,,,,,,
144,14.656983,192.168.43.119,23.219.184.122,TCP,54,50442  >  80 [ACK] Seq=1661 Ack=79014 Win=264 Len=0,,,,,,,,,,,
145,14.660775,23.219.184.122,192.168.43.119,TCP,1434,80  >  50442 [ACK] Seq=79014 Ack=1661 Win=279 Len=1380 [TCP segment of a reassembled PDU],,,,,,,,,,,
146,14.675681,23.219.184.122,192.168.43.119,TCP,1434,80  >  50442 [ACK] Seq=80394 Ack=1661 Win=279 Len=1380 [TCP segment of a reassembled PDU],,,,,,,,,,,
147,14.675813,192.168.43.119,23.219.184.122,TCP,54,50442  >  80 [ACK] Seq=1661 Ack=81774 Win=264 Len=0,,,,,,,,,,,
148,14.679419,23.219.184.122,192.168.43.119,TCP,1434,80  >  50442 [ACK] Seq=81774 Ack=1661 Win=279 Len=1380 [TCP segment of a reassembled PDU],,,,,,,,,,,
149,14.680031,23.219.184.122,192.168.43.119,TCP,1434,80  >  50442 [ACK] Seq=83154 Ack=1661 Win=279 Len=1380 [TCP segment of a reassembled PDU],,,,,,,,,,,
150,14.680031,23.219.184.122,192.168.43.119,TCP,1434,80  >  50442 [ACK] Seq=84534 Ack=1661 Win=279 Len=1380 [TCP segment of a reassembled PDU],,,,,,,,,,,
151,14.680239,192.168.43.119,23.219.184.122,TCP,54,50442  >  80 [ACK] Seq=1661 Ack=85914 Win=264 Len=0,,,,,,,,,,,
152,14.694942,23.219.184.122,192.168.43.119,TCP,1434,80  >  50442 [ACK] Seq=85914 Ack=1661 Win=279 Len=1380 [TCP segment of a reassembled PDU],,,,,,,,,,,
153,14.695117,192.168.43.119,23.219.184.122,TCP,54,50442  >  80 [ACK] Seq=1661 Ack=87294 Win=264 Len=0,,,,,,,,,,,
154,14.696432,23.219.184.122,192.168.43.119,TCP,1434,80  >  50442 [ACK] Seq=87294 Ack=1661 Win=279 Len=1380 [TCP segment of a reassembled PDU],,,,,,,,,,,
155,14.698781,23.219.184.122,192.168.43.119,TCP,1434,80  >  50442 [ACK] Seq=88674 Ack=1661 Win=279 Len=1380 [TCP segment of a reassembled PDU],,,,,,,,,,,
156,14.69889,192.168.43.119,23.219.184.122,TCP,54,50442  >  80 [ACK] Seq=1661 Ack=90054 Win=264 Len=0,,,,,,,,,,,
157,14.700558,23.219.184.122,192.168.43.119,TCP,1434,80  >  50442 [ACK] Seq=90054 Ack=1661 Win=279 Len=1380 [TCP segment of a reassembled PDU],,,,,,,,,,,
158,14.704927,23.219.184.122,192.168.43.119,TCP,1434,80  >  50442 [ACK] Seq=91434 Ack=1661 Win=279 Len=1380 [TCP segment of a reassembled PDU],,,,,,,,,,,
159,14.705054,192.168.43.119,23.219.184.122,TCP,54,50442  >  80 [ACK] Seq=1661 Ack=92814 Win=264 Len=0,,,,,,,,,,,
160,14.719333,23.219.184.122,192.168.43.119,TCP,1434,80  >  50442 [ACK] Seq=92814 Ack=1661 Win=279 Len=1380 [TCP segment of a reassembled PDU],,,,,,,,,,,
161,14.719565,23.219.184.122,192.168.43.119,TCP,1434,80  >  50442 [ACK] Seq=94194 Ack=1661 Win=279 Len=1380 [TCP segment of a reassembled PDU],,,,,,,,,,,
162,14.719702,192.168.43.119,23.219.184.122,TCP,54,50442  >  80 [ACK] Seq=1661 Ack=95574 Win=264 Len=0,,,,,,,,,,,
163,14.727704,23.219.184.122,192.168.43.119,TCP,1434,80  >  50442 [ACK] Seq=95574 Ack=1661 Win=279 Len=1380 [TCP segment of a reassembled PDU],,,,,,,,,,,
164,14.728122,23.219.184.122,192.168.43.119,TCP,1434,80  >  50442 [ACK] Seq=96954 Ack=1661 Win=279 Len=1380 [TCP segment of a reassembled PDU],,,,,,,,,,,
165,14.728122,23.219.184.122,192.168.43.119,TCP,1434,80  >  50442 [ACK] Seq=98334 Ack=1661 Win=279 Len=1380 [TCP segment of a reassembled PDU],,,,,,,,,,,
166,14.728314,192.168.43.119,23.219.184.122,TCP,54,50442  >  80 [ACK] Seq=1661 Ack=99714 Win=264 Len=0,,,,,,,,,,,
167,14.743498,23.219.184.122,192.168.43.119,TCP,1434,80  >  50442 [ACK] Seq=99714 Ack=1661 Win=279 Len=1380 [TCP segment of a reassembled PDU],,,,,,,,,,,
168,14.743678,192.168.43.119,23.219.184.122,TCP,54,50442  >  80 [ACK] Seq=1661 Ack=101094 Win=312 Len=0,,,,,,,,,,,
169,14.744388,23.219.184.122,192.168.43.119,TCP,1434,80  >  50442 [ACK] Seq=101094 Ack=1661 Win=279 Len=1380 [TCP segment of a reassembled PDU],,,,,,,,,,,
170,14.756973,23.219.184.122,192.168.43.119,TCP,1434,80  >  50442 [ACK] Seq=102474 Ack=1661 Win=279 Len=1380 [TCP segment of a reassembled PDU],,,,,,,,,,,
171,14.757154,192.168.43.119,23.219.184.122,TCP,54,50442  >  80 [ACK] Seq=1661 Ack=103854 Win=312 Len=0,,,,,,,,,,,
172,14.767083,23.219.184.122,192.168.43.119,TCP,1434,80  >  50442 [ACK] Seq=103854 Ack=1661 Win=279 Len=1380 [TCP segment of a reassembled PDU],,,,,,,,,,,
173,14.789081,23.219.184.122,192.168.43.119,TCP,1434,80  >  50442 [ACK] Seq=105234 Ack=1661 Win=279 Len=1380 [TCP segment of a reassembled PDU],,,,,,,,,,,
174,14.789191,192.168.43.119,23.219.184.122,TCP,54,50442  >  80 [ACK] Seq=1661 Ack=106614 Win=312 Len=0,,,,,,,,,,,
175,14.810992,23.219.184.122,192.168.43.119,TCP,1434,80  >  50442 [ACK] Seq=106614 Ack=1661 Win=279 Len=1380 [TCP segment of a reassembled PDU],,,,,,,,,,,
176,14.814451,23.219.184.122,192.168.43.119,TCP,1434,80  >  50442 [ACK] Seq=107994 Ack=1661 Win=279 Len=1380 [TCP segment of a reassembled PDU],,,,,,,,,,,
177,14.814598,192.168.43.119,23.219.184.122,TCP,54,50442  >  80 [ACK] Seq=1661 Ack=109374 Win=312 Len=0,,,,,,,,,,,
178,14.814897,23.219.184.122,192.168.43.119,TCP,1434,80  >  50442 [ACK] Seq=109374 Ack=1661 Win=279 Len=1380 [TCP segment of a reassembled PDU],,,,,,,,,,,
179,14.877093,192.168.43.119,23.219.184.122,TCP,54,50442  >  80 [ACK] Seq=1661 Ack=110754 Win=312 Len=0,,,,,,,,,,,
180,14.880002,23.219.184.122,192.168.43.119,TCP,1434,80  >  50442 [ACK] Seq=110754 Ack=1661 Win=279 Len=1380 [TCP segment of a reassembled PDU],,,,,,,,,,,
181,14.8804,23.219.184.122,192.168.43.119,TCP,1434,80  >  50442 [ACK] Seq=112134 Ack=1661 Win=279 Len=1380 [TCP segment of a reassembled PDU],,,,,,,,,,,
182,14.880492,192.168.43.119,23.219.184.122,TCP,54,50442  >  80 [ACK] Seq=1661 Ack=113514 Win=312 Len=0,,,,,,,,,,,
183,14.900274,23.219.184.122,192.168.43.119,TCP,1434,80  >  50442 [ACK] Seq=113514 Ack=1661 Win=279 Len=1380 [TCP segment of a reassembled PDU],,,,,,,,,,,
184,14.900809,23.219.184.122,192.168.43.119,TCP,1434,80  >  50442 [ACK] Seq=114894 Ack=1661 Win=279 Len=1380 [TCP segment of a reassembled PDU],,,,,,,,,,,
185,14.900925,192.168.43.119,23.219.184.122,TCP,54,50442  >  80 [ACK] Seq=1661 Ack=116274 Win=323 Len=0,,,,,,,,,,,
186,14.917398,23.219.184.122,192.168.43.119,TCP,1434,80  >  50442 [ACK] Seq=116274 Ack=1661 Win=279 Len=1380 [TCP segment of a reassembled PDU],,,,,,,,,,,
187,14.917713,23.219.184.122,192.168.43.119,TCP,1434,80  >  50442 [ACK] Seq=117654 Ack=1661 Win=279 Len=1380 [TCP segment of a reassembled PDU],,,,,,,,,,,
188,14.917713,23.219.184.122,192.168.43.119,HTTP,220,HTTP/1.1 206 Partial Content ,,,,,,,,,,,
189,14.917848,192.168.43.119,23.219.184.122,TCP,54,50442  >  80 [ACK] Seq=1661 Ack=119200 Win=323 Len=0,,,,,,,,,,,
190,16.878007,192.168.43.119,104.118.106.95,HTTP,372,GET /pr/64256afe-f5d9-4f86-8936-8840a6a4f5be/Office/Data/16.0.12527.21104/stream.x64.en-us.dat HTTP/1.1 ,,,,,,,,,,,
191,17.221344,fe80::9c9f:8930:3bd4:496e,ff02::1:2,DHCPv6,157,Solicit XID: 0x7de883 CID: 00010001219c10b0a81e84a01b87 ,,,,,,,,,,,
192,17.22846,fe80::2072:dff:fe39:154b,fe80::9c9f:8930:3bd4:496e,DHCPv6,144,Advertise XID: 0x7de883 CID: 00010001219c10b0a81e84a01b87 ,,,,,,,,,,,
193,17.320938,104.118.106.95,192.168.43.119,HTTP,345,HTTP/1.1 301 Moved Permanently ,,,,,,,,,,,
194,17.321494,192.168.43.119,23.219.184.122,HTTP,386,GET /pr/64256afe-f5d9-4f86-8936-8840a6a4f5be/Office/Data/16.0.12527.21104/stream.x64.en-us.dat HTTP/1.1 ,,,,,,,,,,,
195,17.377357,192.168.43.119,104.118.106.95,TCP,54,50440  >  80 [ACK] Seq=1909 Ack=1747 Win=62 Len=0,,,,,,,,,,,
196,17.673723,23.219.184.122,192.168.43.119,TCP,1434,80  >  50442 [ACK] Seq=119200 Ack=1993 Win=287 Len=1380 [TCP segment of a reassembled PDU],,,,,,,,,,,
197,17.683883,23.219.184.122,192.168.43.119,TCP,1434,80  >  50442 [ACK] Seq=120580 Ack=1993 Win=287 Len=1380 [TCP segment of a reassembled PDU],,,,,,,,,,,
198,17.683991,192.168.43.119,23.219.184.122,TCP,54,50442  >  80 [ACK] Seq=1993 Ack=121960 Win=323 Len=0,,,,,,,,,,,
199,17.684183,23.219.184.122,192.168.43.119,TCP,306,"80  >  50442 [PSH, ACK] Seq=121960 Ack=1993 Win=287 Len=252 [TCP segment of a reassembled PDU]",,,,,,,,,,,
200,17.691155,23.219.184.122,192.168.43.119,TCP,1434,80  >  50442 [ACK] Seq=122212 Ack=1993 Win=287 Len=1380 [TCP segment of a reassembled PDU],,,,,,,,,,,
201,17.691294,192.168.43.119,23.219.184.122,TCP,54,50442  >  80 [ACK] Seq=1993 Ack=123592 Win=323 Len=0,,,,,,,,,,,
202,17.693156,23.219.184.122,192.168.43.119,TCP,1434,80  >  50442 [ACK] Seq=123592 Ack=1993 Win=287 Len=1380 [TCP segment of a reassembled PDU],,,,,,,,,,,
203,17.696763,23.219.184.122,192.168.43.119,TCP,1434,80  >  50442 [ACK] Seq=124972 Ack=1993 Win=287 Len=1380 [TCP segment of a reassembled PDU],,,,,,,,,,,
204,17.696855,192.168.43.119,23.219.184.122,TCP,54,50442  >  80 [ACK] Seq=1993 Ack=126352 Win=323 Len=0,,,,,,,,,,,
205,17.697126,23.219.184.122,192.168.43.119,TCP,1434,80  >  50442 [ACK] Seq=126352 Ack=1993 Win=287 Len=1380 [TCP segment of a reassembled PDU],,,,,,,,,,,
206,17.710825,23.219.184.122,192.168.43.119,TCP,1434,80  >  50442 [ACK] Seq=127732 Ack=1993 Win=287 Len=1380 [TCP segment of a reassembled PDU],,,,,,,,,,,
207,17.710957,192.168.43.119,23.219.184.122,TCP,54,50442  >  80 [ACK] Seq=1993 Ack=129112 Win=323 Len=0,,,,,,,,,,,
208,17.714209,23.219.184.122,192.168.43.119,TCP,1434,80  >  50442 [ACK] Seq=129112 Ack=1993 Win=287 Len=1380 [TCP segment of a reassembled PDU],,,,,,,,,,,
209,17.71498,23.219.184.122,192.168.43.119,TCP,1434,80  >  50442 [ACK] Seq=130492 Ack=1993 Win=287 Len=1380 [TCP segment of a reassembled PDU],,,,,,,,,,,
210,17.7151,192.168.43.119,23.219.184.122,TCP,54,50442  >  80 [ACK] Seq=1993 Ack=131872 Win=323 Len=0,,,,,,,,,,,
211,17.729111,23.219.184.122,192.168.43.119,TCP,1434,80  >  50442 [ACK] Seq=131872 Ack=1993 Win=287 Len=1380 [TCP segment of a reassembled PDU],,,,,,,,,,,
212,17.729742,23.219.184.122,192.168.43.119,TCP,1434,80  >  50442 [ACK] Seq=133252 Ack=1993 Win=287 Len=1380 [TCP segment of a reassembled PDU],,,,,,,,,,,
213,17.729742,23.219.184.122,192.168.43.119,TCP,1434,80  >  50442 [ACK] Seq=134632 Ack=1993 Win=287 Len=1380 [TCP segment of a reassembled PDU],,,,,,,,,,,
214,17.729742,23.219.184.122,192.168.43.119,TCP,1434,80  >  50442 [ACK] Seq=136012 Ack=1993 Win=287 Len=1380 [TCP segment of a reassembled PDU],,,,,,,,,,,
215,17.729914,192.168.43.119,23.219.184.122,TCP,54,50442  >  80 [ACK] Seq=1993 Ack=137392 Win=323 Len=0,,,,,,,,,,,
216,17.743445,23.219.184.122,192.168.43.119,TCP,1434,80  >  50442 [ACK] Seq=137392 Ack=1993 Win=287 Len=1380 [TCP segment of a reassembled PDU],,,,,,,,,,,
217,17.744711,23.219.184.122,192.168.43.119,TCP,1434,80  >  50442 [ACK] Seq=138772 Ack=1993 Win=287 Len=1380 [TCP segment of a reassembled PDU],,,,,,,,,,,
218,17.74477,192.168.43.119,23.219.184.122,TCP,54,50442  >  80 [ACK] Seq=1993 Ack=140152 Win=323 Len=0,,,,,,,,,,,
219,17.746417,23.219.184.122,192.168.43.119,TCP,1434,80  >  50442 [ACK] Seq=140152 Ack=1993 Win=287 Len=1380 [TCP segment of a reassembled PDU],,,,,,,,,,,
220,17.748489,23.219.184.122,192.168.43.119,TCP,1434,80  >  50442 [ACK] Seq=141532 Ack=1993 Win=287 Len=1380 [TCP segment of a reassembled PDU],,,,,,,,,,,
221,17.748618,192.168.43.119,23.219.184.122,TCP,54,50442  >  80 [ACK] Seq=1993 Ack=142912 Win=323 Len=0,,,,,,,,,,,
222,17.764056,23.219.184.122,192.168.43.119,TCP,1434,80  >  50442 [ACK] Seq=142912 Ack=1993 Win=287 Len=1380 [TCP segment of a reassembled PDU],,,,,,,,,,,
223,17.770288,23.219.184.122,192.168.43.119,TCP,1434,80  >  50442 [ACK] Seq=144292 Ack=1993 Win=287 Len=1380 [TCP segment of a reassembled PDU],,,,,,,,,,,
224,17.770429,192.168.43.119,23.219.184.122,TCP,54,50442  >  80 [ACK] Seq=1993 Ack=145672 Win=323 Len=0,,,,,,,,,,,
225,17.770662,23.219.184.122,192.168.43.119,TCP,1434,80  >  50442 [ACK] Seq=145672 Ack=1993 Win=287 Len=1380 [TCP segment of a reassembled PDU],,,,,,,,,,,
226,17.776667,23.219.184.122,192.168.43.119,TCP,1434,80  >  50442 [ACK] Seq=147052 Ack=1993 Win=287 Len=1380 [TCP segment of a reassembled PDU],,,,,,,,,,,
227,17.7768,192.168.43.119,23.219.184.122,TCP,54,50442  >  80 [ACK] Seq=1993 Ack=148432 Win=323 Len=0,,,,,,,,,,,
228,17.785135,23.219.184.122,192.168.43.119,TCP,1434,80  >  50442 [ACK] Seq=148432 Ack=1993 Win=287 Len=1380 [TCP segment of a reassembled PDU],,,,,,,,,,,
229,17.786612,23.219.184.122,192.168.43.119,TCP,1434,80  >  50442 [ACK] Seq=149812 Ack=1993 Win=287 Len=1380 [TCP segment of a reassembled PDU],,,,,,,,,,,
230,17.786698,192.168.43.119,23.219.184.122,TCP,54,50442  >  80 [ACK] Seq=1993 Ack=151192 Win=323 Len=0,,,,,,,,,,,
231,17.793516,23.219.184.122,192.168.43.119,TCP,1434,80  >  50442 [ACK] Seq=151192 Ack=1993 Win=287 Len=1380 [TCP segment of a reassembled PDU],,,,,,,,,,,
232,17.794202,23.219.184.122,192.168.43.119,TCP,1434,80  >  50442 [ACK] Seq=152572 Ack=1993 Win=287 Len=1380 [TCP segment of a reassembled PDU],,,,,,,,,,,
233,17.794301,192.168.43.119,23.219.184.122,TCP,54,50442  >  80 [ACK] Seq=1993 Ack=153952 Win=323 Len=0,,,,,,,,,,,
234,17.809004,23.219.184.122,192.168.43.119,TCP,1434,80  >  50442 [ACK] Seq=153952 Ack=1993 Win=287 Len=1380 [TCP segment of a reassembled PDU],,,,,,,,,,,
235,17.814292,23.219.184.122,192.168.43.119,TCP,1434,80  >  50442 [ACK] Seq=155332 Ack=1993 Win=287 Len=1380 [TCP segment of a reassembled PDU],,,,,,,,,,,
236,17.814365,192.168.43.119,23.219.184.122,TCP,54,50442  >  80 [ACK] Seq=1993 Ack=156712 Win=323 Len=0,,,,,,,,,,,
237,17.816745,23.219.184.122,192.168.43.119,TCP,1434,80  >  50442 [ACK] Seq=156712 Ack=1993 Win=287 Len=1380 [TCP segment of a reassembled PDU],,,,,,,,,,,
238,17.833739,23.219.184.122,192.168.43.119,TCP,1434,80  >  50442 [ACK] Seq=158092 Ack=1993 Win=287 Len=1380 [TCP segment of a reassembled PDU],,,,,,,,,,,
239,17.833878,192.168.43.119,23.219.184.122,TCP,54,50442  >  80 [ACK] Seq=1993 Ack=159472 Win=350 Len=0,,,,,,,,,,,
240,17.834353,23.219.184.122,192.168.43.119,TCP,1434,80  >  50442 [ACK] Seq=159472 Ack=1993 Win=287 Len=1380 [TCP segment of a reassembled PDU],,,,,,,,,,,
241,17.836854,23.219.184.122,192.168.43.119,TCP,1434,80  >  50442 [ACK] Seq=160852 Ack=1993 Win=287 Len=1380 [TCP segment of a reassembled PDU],,,,,,,,,,,
242,17.836986,192.168.43.119,23.219.184.122,TCP,54,50442  >  80 [ACK] Seq=1993 Ack=162232 Win=350 Len=0,,,,,,,,,,,
243,17.840802,23.219.184.122,192.168.43.119,TCP,1434,80  >  50442 [ACK] Seq=162232 Ack=1993 Win=287 Len=1380 [TCP segment of a reassembled PDU],,,,,,,,,,,
244,17.843431,23.219.184.122,192.168.43.119,TCP,1434,80  >  50442 [ACK] Seq=163612 Ack=1993 Win=287 Len=1380 [TCP segment of a reassembled PDU],,,,,,,,,,,
245,17.843566,192.168.43.119,23.219.184.122,TCP,54,50442  >  80 [ACK] Seq=1993 Ack=164992 Win=350 Len=0,,,,,,,,,,,
246,17.851214,23.219.184.122,192.168.43.119,TCP,1434,80  >  50442 [ACK] Seq=164992 Ack=1993 Win=287 Len=1380 [TCP segment of a reassembled PDU],,,,,,,,,,,
247,17.86434,23.219.184.122,192.168.43.119,TCP,1434,80  >  50442 [ACK] Seq=166372 Ack=1993 Win=287 Len=1380 [TCP segment of a reassembled PDU],,,,,,,,,,,
248,17.86448,192.168.43.119,23.219.184.122,TCP,54,50442  >  80 [ACK] Seq=1993 Ack=167752 Win=350 Len=0,,,,,,,,,,,
249,17.865032,23.219.184.122,192.168.43.119,TCP,1434,80  >  50442 [ACK] Seq=167752 Ack=1993 Win=287 Len=1380 [TCP segment of a reassembled PDU],,,,,,,,,,,
250,17.867443,23.219.184.122,192.168.43.119,TCP,1434,80  >  50442 [ACK] Seq=169132 Ack=1993 Win=287 Len=1380 [TCP segment of a reassembled PDU],,,,,,,,,,,
251,17.867551,192.168.43.119,23.219.184.122,TCP,54,50442  >  80 [ACK] Seq=1993 Ack=170512 Win=350 Len=0,,,,,,,,,,,
252,17.867825,23.219.184.122,192.168.43.119,TCP,1434,80  >  50442 [ACK] Seq=170512 Ack=1993 Win=287 Len=1380 [TCP segment of a reassembled PDU],,,,,,,,,,,
253,17.880924,23.219.184.122,192.168.43.119,TCP,1434,80  >  50442 [ACK] Seq=171892 Ack=1993 Win=287 Len=1380 [TCP segment of a reassembled PDU],,,,,,,,,,,
254,17.881059,192.168.43.119,23.219.184.122,TCP,54,50442  >  80 [ACK] Seq=1993 Ack=173272 Win=350 Len=0,,,,,,,,,,,
255,17.884904,23.219.184.122,192.168.43.119,TCP,1434,80  >  50442 [ACK] Seq=173272 Ack=1993 Win=287 Len=1380 [TCP segment of a reassembled PDU],,,,,,,,,,,
256,17.886676,23.219.184.122,192.168.43.119,TCP,1434,80  >  50442 [ACK] Seq=174652 Ack=1993 Win=287 Len=1380 [TCP segment of a reassembled PDU],,,,,,,,,,,
257,17.886807,192.168.43.119,23.219.184.122,TCP,54,50442  >  80 [ACK] Seq=1993 Ack=176032 Win=350 Len=0,,,,,,,,,,,
258,17.888681,23.219.184.122,192.168.43.119,TCP,1434,80  >  50442 [ACK] Seq=176032 Ack=1993 Win=287 Len=1380 [TCP segment of a reassembled PDU],,,,,,,,,,,
259,17.890716,23.219.184.122,192.168.43.119,TCP,1434,80  >  50442 [ACK] Seq=177412 Ack=1993 Win=287 Len=1380 [TCP segment of a reassembled PDU],,,,,,,,,,,
260,17.890853,192.168.43.119,23.219.184.122,TCP,54,50442  >  80 [ACK] Seq=1993 Ack=178792 Win=350 Len=0,,,,,,,,,,,
261,17.894747,23.219.184.122,192.168.43.119,TCP,1434,80  >  50442 [ACK] Seq=178792 Ack=1993 Win=287 Len=1380 [TCP segment of a reassembled PDU],,,,,,,,,,,
262,17.896305,23.219.184.122,192.168.43.119,TCP,1434,80  >  50442 [ACK] Seq=180172 Ack=1993 Win=287 Len=1380 [TCP segment of a reassembled PDU],,,,,,,,,,,
263,17.896443,192.168.43.119,23.219.184.122,TCP,54,50442  >  80 [ACK] Seq=1993 Ack=181552 Win=398 Len=0,,,,,,,,,,,
264,17.931938,23.219.184.122,192.168.43.119,TCP,1434,80  >  50442 [ACK] Seq=181552 Ack=1993 Win=287 Len=1380 [TCP segment of a reassembled PDU],,,,,,,,,,,
265,17.933248,23.219.184.122,192.168.43.119,TCP,1434,80  >  50442 [ACK] Seq=182932 Ack=1993 Win=287 Len=1380 [TCP segment of a reassembled PDU],,,,,,,,,,,
266,17.933248,23.219.184.122,192.168.43.119,TCP,1434,80  >  50442 [ACK] Seq=184312 Ack=1993 Win=287 Len=1380 [TCP segment of a reassembled PDU],,,,,,,,,,,
267,17.933248,23.219.184.122,192.168.43.119,TCP,1434,80  >  50442 [ACK] Seq=185692 Ack=1993 Win=287 Len=1380 [TCP segment of a reassembled PDU],,,,,,,,,,,
268,17.933248,23.219.184.122,192.168.43.119,TCP,1434,80  >  50442 [ACK] Seq=187072 Ack=1993 Win=287 Len=1380 [TCP segment of a reassembled PDU],,,,,,,,,,,
269,17.933248,23.219.184.122,192.168.43.119,TCP,1434,80  >  50442 [ACK] Seq=188452 Ack=1993 Win=287 Len=1380 [TCP segment of a reassembled PDU],,,,,,,,,,,
270,17.933248,23.219.184.122,192.168.43.119,TCP,1434,80  >  50442 [ACK] Seq=189832 Ack=1993 Win=287 Len=1380 [TCP segment of a reassembled PDU],,,,,,,,,,,
271,17.93354,192.168.43.119,23.219.184.122,TCP,54,50442  >  80 [ACK] Seq=1993 Ack=191212 Win=398 Len=0,,,,,,,,,,,
272,17.93506,23.219.184.122,192.168.43.119,TCP,1434,80  >  50442 [ACK] Seq=191212 Ack=1993 Win=287 Len=1380 [TCP segment of a reassembled PDU],,,,,,,,,,,
273,17.935213,192.168.43.119,23.219.184.122,TCP,54,50442  >  80 [ACK] Seq=1993 Ack=192592 Win=398 Len=0,,,,,,,,,,,
274,17.948996,23.219.184.122,192.168.43.119,TCP,1434,80  >  50442 [ACK] Seq=192592 Ack=1993 Win=287 Len=1380 [TCP segment of a reassembled PDU],,,,,,,,,,,
275,17.953293,23.219.184.122,192.168.43.119,TCP,1434,80  >  50442 [ACK] Seq=193972 Ack=1993 Win=287 Len=1380 [TCP segment of a reassembled PDU],,,,,,,,,,,
276,17.953425,192.168.43.119,23.219.184.122,TCP,54,50442  >  80 [ACK] Seq=1993 Ack=195352 Win=398 Len=0,,,,,,,,,,,
277,17.955402,23.219.184.122,192.168.43.119,TCP,1434,80  >  50442 [ACK] Seq=195352 Ack=1993 Win=287 Len=1380 [TCP segment of a reassembled PDU],,,,,,,,,,,
278,17.956079,23.219.184.122,192.168.43.119,TCP,1434,80  >  50442 [ACK] Seq=196732 Ack=1993 Win=287 Len=1380 [TCP segment of a reassembled PDU],,,,,,,,,,,
279,17.956079,23.219.184.122,192.168.43.119,TCP,1434,80  >  50442 [ACK] Seq=198112 Ack=1993 Win=287 Len=1380 [TCP segment of a reassembled PDU],,,,,,,,,,,
280,17.956252,192.168.43.119,23.219.184.122,TCP,54,50442  >  80 [ACK] Seq=1993 Ack=199492 Win=398 Len=0,,,,,,,,,,,
281,17.958649,23.219.184.122,192.168.43.119,TCP,1434,80  >  50442 [ACK] Seq=199492 Ack=1993 Win=287 Len=1380 [TCP segment of a reassembled PDU],,,,,,,,,,,
282,17.958761,192.168.43.119,23.219.184.122,TCP,54,50442  >  80 [ACK] Seq=1993 Ack=200872 Win=436 Len=0,,,,,,,,,,,
283,17.960671,23.219.184.122,192.168.43.119,TCP,1434,80  >  50442 [ACK] Seq=200872 Ack=1993 Win=287 Len=1380 [TCP segment of a reassembled PDU],,,,,,,,,,,
284,17.964079,23.219.184.122,192.168.43.119,TCP,914,80  >  50442 [ACK] Seq=202252 Ack=1993 Win=287 Len=860 [TCP segment of a reassembled PDU],,,,,,,,,,,
285,17.964206,192.168.43.119,23.219.184.122,TCP,54,50442  >  80 [ACK] Seq=1993 Ack=203112 Win=436 Len=0,,,,,,,,,,,
286,17.964403,23.219.184.122,192.168.43.119,TCP,1434,80  >  50442 [ACK] Seq=203112 Ack=1993 Win=287 Len=1380 [TCP segment of a reassembled PDU],,,,,,,,,,,
287,17.980782,23.219.184.122,192.168.43.119,TCP,1434,80  >  50442 [ACK] Seq=204492 Ack=1993 Win=287 Len=1380 [TCP segment of a reassembled PDU],,,,,,,,,,,
288,17.980916,192.168.43.119,23.219.184.122,TCP,54,50442  >  80 [ACK] Seq=1993 Ack=205872 Win=436 Len=0,,,,,,,,,,,
289,17.982751,23.219.184.122,192.168.43.119,TCP,1434,80  >  50442 [ACK] Seq=205872 Ack=1993 Win=287 Len=1380 [TCP segment of a reassembled PDU],,,,,,,,,,,
